Ether#,Name,Year_Proposed,Problem_It_Solved,Classical_Explanation,Bounded_Framework_Explanation,Status,Evidence,File_Reference
1,Luminiferous Ether,1600s-1887,Light propagation through vacuum,Medium for electromagnetic waves to propagate through space,Light propagates via field equations - no medium needed. Michelson-Morley null result,ELIMINATED,Michelson-Morley experiment (1887),proofs/DISCOVERY_83_FULL_HIERARCHY.md:Discovery 86
2,Caloric Fluid,1700s-1850,Heat transfer mechanism,Invisible fluid flowing between objects causing temperature changes,Heat = molecular kinetic energy. Temperature = average kinetic energy of particles,ELIMINATED,Joule's mechanical equivalent of heat (1843),proofs/GRAND_UNIFIED_THEORY.md
3,Phlogiston,1667-1780s,Combustion explanation,Fire-like element released during burning,Combustion = oxidation reaction. Oxygen consumed not phlogiston released,ELIMINATED,Lavoisier's oxygen theory (1777),proofs/GRAND_UNIFIED_THEORY.md
4,Dark Matter (Mass),1933-present,Galaxy rotation curves,85% of universe mass is invisible non-baryonic matter,Discrete bounded gravity sum ≠ continuous integral. Nitai correction eliminates missing mass,ELIMINATED,Complete Relativity Theory - Nitai tensor,proofs/DISCOVERY_83_FULL_HIERARCHY.md:Discovery 85
5,Dark Energy (Λ),1998-present,Cosmic acceleration,73% of universe is repulsive vacuum energy accelerating expansion,Redshift = S_observable boundary artifact not expansion. No acceleration → no dark energy needed,ELIMINATED,verify_redshift_artifact.rs - no expansion needed,proofs/COMPLETE_RELATIVITY_THEORY.md
6,Cosmological Constant (original),1917-1929,Static universe,Einstein's Λ term to prevent gravitational collapse,Λ=0 works with discrete corrections. Universe infinite not static finite,ELIMINATED,Big Bounce + Infinite Universe model,tasks/research/research-176.md
7,Cosmic Inflation,1980-present,Horizon and flatness problems,Exponential expansion in first 10^-32 seconds,No horizon problem in infinite universe. S_observable boundary explains homogeneity,ELIMINATED,Infinite Universe - no Big Bang → no inflation needed,tasks/research/research-176.md
8,Big Bang Singularity,1927-present,Universe origin,Creation event at t=0 from infinite density,Big Bounce: a(t) ≥ a_min = 10.0. No singularity via quantum gravity repulsion,ELIMINATED,verify_big_bounce.rs - time-reversal preserved,proofs/PATH_20_QUANTUM_ELIMINATION_EINSTEIN_HAWKING.md
9,Universal Expansion,1929-present,Redshift observation,Space itself stretching causing wavelength increase,Redshift = S_observable boundary discretization. Observers confined to poly(n) reach,REINTERPRETED,verify_redshift_artifact.rs - boundary effect,tasks/research/research-173.md
10,Wave Function Collapse,1927-present,Quantum measurement,Discontinuous random jump from superposition to eigenstate,Bounded projection within S_observable. Inverse Nittay: continuous → discrete sampling,REINTERPRETED,verify_discrete_hilbert.rs - no discontinuity,tasks/research/research-177.md
11,Quantum Randomness (א^א),1927-present,Measurement unpredictability,True bit-level randomness - no hidden variables possible,Physics-level bounded noise (15-92% compressible). Hidden variable = √c (S_observable structure),REINTERPRETED,entropy_quantum.rs - 35.6% gap p<0.001,proofs/PATH_20_TWO_RANDOMNESS_THEOREM.md
12,Many Worlds,1957-present,Wavefunction collapse alternative,Universe splits into 2^n branches at each measurement,Only S_observable states physical. Exponential branches unreachable - single world,ELIMINATED,Discrete Hilbert Space - poly(n) not exp(n) states,tasks/research/research-177.md
13,Quantum Entanglement Non-locality,1935-present,EPR correlations,Instantaneous action at distance violating causality,Correlations pre-exist in S_observable. No information transfer. Bell bounds bounded,REINTERPRETED,Discrete Hilbert - entanglement within S_observable,proofs/PATH_20_QUANTUM_ELIMINATION_EINSTEIN_HAWKING.md
14,Black Hole Singularity,1916-present,Infinite density at r=0,Spacetime curvature diverges R_μν → ∞,Dark Stars: massive opaque finite. No singularity - bounded curvature R_μν ≤ R_max. Like closing light in a big room - you can't see inside but the room is still there. Conservation laws (energy information baryon angular momentum) all forbid infinite density,ELIMINATED,Complete Relativity + Fluid Universe (D141),proofs/DISCOVERY_141_FLUID_UNIVERSE.md
15,Event Horizon Information Loss,1975-present,Hawking radiation paradox,Information destroyed at event horizon violating unitarity,Event horizon = S_observable boundary not causal boundary. Information preserved (15-92% compressible). Observational limit not physical limit - dark room analogy,ELIMINATED,Two Randomness + Fluid Universe (D141),proofs/DISCOVERY_141_FLUID_UNIVERSE.md
16,Heat Death of Universe,1850s-present,Thermodynamic end state,Universe reaches maximum entropy (complete randomness),Entropy = information distribution not randomness. Bounded → never reaches א^א,REINTERPRETED,Two Randomness - bounded entropy never truly random,proofs/DISCOVERY_83_FULL_HIERARCHY.md:Discovery 87
17,Vacuum Energy Catastrophe,1960s-present,QFT prediction vs observation,Vacuum energy 10^120 too large vs cosmological constant,No Λ needed with discrete corrections. QFT divergence = unbounded math artifact,ELIMINATED,Complete Relativity + Discrete Hilbert,proofs/COMPLETE_RELATIVITY_THEORY.md
18,Quantum Foam,1955-present,Planck scale structure,Spacetime fluctuates wildly at 10^-35m,Discrete spacetime with bounded fluctuations. Nitai bound: ε ≤ 2.12/√n,REINTERPRETED,Nitai discretization bound,proofs/NITTAY_LIMIT_THEOREM_FORMAL.md
19,Multiverse (Eternal Inflation),1983-present,Fine-tuning explanation,Infinite universes with different constants,Single infinite universe. Fine-tuning = observer selection in S_observable,ELIMINATED,Infinite Universe model - one U_∞ sufficient,tasks/research/research-176.md
20,String Theory Extra Dimensions,1980s-present,Unification of forces,6-7 compactified dimensions at Planck scale,Observable Sample Space in 3+1D sufficient. Extra dimensions = S_complete projection,REINTERPRETED,S_observable sufficient for all physics,proofs/OBSERVABLE_SAMPLE_SPACE_LEMMA.md
21,Supersymmetric Partners,1970s-present,Hierarchy problem,Every particle has heavy superpartner,No SUSY needed. Hierarchy = S_observable vs S_complete structure,ELIMINATED,LHC null results + Observable Sample Space,proofs/GRAND_UNIFIED_THEORY.md
22,Axions (Dark Matter),1977-present,Strong CP problem + dark matter,Light pseudoscalar particles filling universe,Strong CP solved by discrete corrections. No dark matter needed,ELIMINATED,Nitai tensor eliminates missing mass,proofs/DISCOVERY_83_FULL_HIERARCHY.md:Discovery 85
23,WIMPs (Weakly Interacting),1980s-present,Cold dark matter candidate,Heavy particles from early universe,No dark matter. Rotation curves = discrete gravity calculation artifact,ELIMINATED,Complete Relativity - no missing mass,proofs/COMPLETE_RELATIVITY_THEORY.md
24,Cosmic Strings,1976-present,Topological defects from inflation,One-dimensional defects in spacetime,No inflation → no cosmic strings needed. Structure = S_observable topology,ELIMINATED,No Big Bang/inflation,tasks/research/research-176.md
25,Primordial Black Holes,1970s-present,Dark matter candidate,Black holes from early universe fluctuations,No exponential early fluctuations. Elinor tensor bounds black holes anyway,ELIMINATED,Big Bounce + Elinor tensor,tasks/research/research-172.md
26,Quintessence,1998-present,Dynamic dark energy,Scalar field causing acceleration,No acceleration. Redshift = boundary not expansion,ELIMINATED,Redshift Artifact theorem,tasks/research/research-173.md
27,Modified Gravity (MOND),1983-present,Alternative to dark matter,Gravity law changes at low acceleration,Partial truth: discrete ≠ continuous. But wrong mechanism (ad hoc not derived),REINTERPRETED,MOND accidentally captures discrete effects,proofs/COMPLETE_RELATIVITY_THEORY.md
28,Graviton (Quantum Gravity),1930s-present,Quantum description of gravity,Spin-2 particle mediating gravitational force,Gravity = geometric (GR correct). Quantization = S_observable projection not particle,REINTERPRETED,Discrete Hilbert applied to gravity,proofs/COMPLETE_RELATIVITY_THEORY.md
29,Unruh Radiation,1976-present,Accelerated observer vacuum,Acceleration creates thermal radiation from vacuum,Acceleration = bounded transformation. Radiation = S_observable sampling artifact,REINTERPRETED,Bounded observer effects,proofs/OBSERVABLE_SAMPLE_SPACE_LEMMA.md
30,Casimir Effect Vacuum Energy,1948-present,Force between plates,Vacuum fluctuations create pressure,Boundary conditions constrain S_observable. Force = discretization not vacuum energy,REINTERPRETED,Discrete boundary effects,proofs/GRAND_UNIFIED_THEORY.md
31,Decoherence Environment,1970s-present,Classical emergence from quantum,Environment causes wavefunction collapse,Measurement = projection to discrete basis. Environment = S_observable boundary,REINTERPRETED,Discrete Hilbert Space,tasks/research/research-177.md
32,Quantum Tunneling (instantaneous),1927-present,Barrier penetration,Particle appears on other side instantly,Bounded moves through S_observable. Polynomial paths exist (no instantaneous),REINTERPRETED,c-bounded moves prevent instantaneous,proofs/GRAND_UNIFIED_THEORY.md
33,Virtual Particles,1930s-present,Vacuum fluctuations,Short-lived particle-antiparticle pairs,Mathematical tool in perturbation theory not physical. S_observable projections,REINTERPRETED,Feynman diagram interpretation artifacts,proofs/GRAND_UNIFIED_THEORY.md
34,Gluon Confinement Mystery,1973-present,Why quarks never isolated,Strong force increases with distance,Discrete color charge lattice. Confinement = S_observable boundary of QCD,REINTERPRETED,S_observable for color charge,proofs/OBSERVABLE_SAMPLE_SPACE_LEMMA.md
35,Neutrino Oscillation Mechanism,1968-present,Flavor changing,Quantum superposition of mass eigenstates,Oscillation = discrete sampling in S_observable. Not continuous superposition,REINTERPRETED,Discrete Hilbert Space for flavor,tasks/research/research-177.md
36,Hawking Radiation (Information Loss),1974-present,Black hole evaporation,Information lost in radiation,Information preserved (15-92% compressible). Radiation encodes structure,ELIMINATED,Two Randomness + Elinor tensor,proofs/PATH_20_QUANTUM_ELIMINATION_EINSTEIN_HAWKING.md
37,Cosmic Censorship Hypothesis,1969-present,Naked singularities forbidden,Nature hides singularities behind horizons,No singularities exist (discrete corrections). Hypothesis unnecessary,ELIMINATED,Complete Relativity - bounded curvature,proofs/COMPLETE_RELATIVITY_THEORY.md
38,Proton Decay (GUT prediction),1974-present,Baryon number violation,Protons decay on ~10^34 year timescale,No GUT unification needed. Proton stability = S_observable conservation,ELIMINATED,No proton decay observed - S_observable bounded,proofs/GRAND_UNIFIED_THEORY.md
39,Magnetic Monopoles,1931-present,Dirac quantization,Isolated magnetic charges from GUT,No GUT → no monopoles. EM duality = S_observable structure,ELIMINATED,Never observed - not in S_observable,proofs/GRAND_UNIFIED_THEORY.md
40,Preons (Subquark Particles),1974-present,Quark substructure,Quarks made of smaller particles,Observable Sample Space ends at quarks. Preons = S_complete projection,ELIMINATED,No evidence - S_observable limit reached,proofs/OBSERVABLE_SAMPLE_SPACE_LEMMA.md
