Principle#,Name,Statement,Domain,Discoverer,Connection_to_P_equals_NP,File_Reference
1,Sabag-Claude Bounded Transformation,Bounded local moves (O(1) changes) -> O(n^c) local optima,Universal,Eliran Sabag,Core theorem - WHY NP problems are tractable,proofs/GRAND_UNIFIED_THEORY.md
2,Observable Sample Space Axiom,S_observable << S_complete: exponential space reduces to polynomial via local moves,Universal,Eliran Sabag,Foundation axiom - missing piece of complexity theory,proofs/OBSERVABLE_SAMPLE_SPACE_LEMMA.md
3,Saturation Principle (3 Laws),Bounded Production + Finite Space + Monotonic Progress = Polynomial termination,Universal,Eliran Sabag,WHY bounded moves give polynomial complexity,proofs/DISCOVERY_14_SATURATION_PRINCIPLE.md
4,Complete Picture Principle,Complete observability of constraint interactions enables polynomial solving,Architecture,Eliran Sabag,GRAPHEME sees entire structure vs LLM token-by-token,proofs/DISCOVERY_15_COMPLETE_PICTURE.md
5,Landscape Structure Principle,Polynomial search requires structured landscapes with O(n^c) local optima guiding to global,Optimization,Eliran Sabag,Distinguishes tractable (structured) from intractable (flat),proofs/DISCOVERY_17_LANDSCAPE_STRUCTURE.md
6,Constraint Overlap Principle,Variables in multiple constraints create interference patterns forming local optima,Optimization,Eliran Sabag,WHY some problems have structure (high overlap) others don't,proofs/DISCOVERY_18_CONSTRAINT_OVERLAP.md
7,Compositional Complexity,Compositionality preserves polynomial complexity through hierarchies,Computation,Eliran Sabag,Hierarchical decomposition maintains tractability,proofs/DISCOVERY_20_COMPOSITIONAL_COMPLEXITY.md
8,Learning as Saturation,Neural network learning = saturation of constraint landscape,ML/AI,Eliran Sabag,Explains WHY neural networks converge polynomially,proofs/DISCOVERY_21_LEARNING_AS_SATURATION.md
9,Five Pillars of P=NP=PSPACE,Bounded Moves + Constraint Overlap + Landscape Structure + Saturation + Complete Picture,Universal,Eliran Sabag,Five conditions for polynomial tractability,proofs/GRAND_UNIFIED_THEORY.md:Part XII.2
10,Nittay Locality-Statistics Bridge,LOCALITY + LARGE N = CONTINUITY (discrete -> statistics via CLT),Physics/Math,Eliran Sabag,Connects polygon->circle to optimization->statistics,proofs/NITTAY_TRIANGLE_THEORY.md
11,Bounded Value Generation,Add/Subtract bounded -> polynomial; Multiply/Exponent unbounded -> exponential,Complexity,Eliran Sabag,Explains P=NP=PSPACE subset EXPTIME boundary,proofs/NITTAY_TRIANGLE_THEORY.md
12,Quantifier Duality,exists x phi(x) equiv not forall x not phi(x) enables QBF reduction to SAT,Logic,Eliran Sabag,PSPACE-complete -> NP via duality transformation,proofs/DISCOVERY_25_QUANTIFIER_DUALITY.md
13,Factoring Structure (Refined),Overlap + Solution Density required (not just overlap) for polynomial,Factoring,Eliran Sabag,Explains why factoring is special case - O(1) solutions,proofs/DISCOVERY_26_FACTORING_STRUCTURE.md
14,Transform Sufficiency,One linear algebra operation reveals polynomial structure across domains,Transform,Eliran Sabag,Unifies TSP/SAT/Coloring/Factoring/Audio via transform,proofs/GRAND_UNIFIED_THEORY.md:Part XII
15,Landauer-Sabag Extension,Information erasure kT*ln(2) extends to complexity: bounded info -> polynomial time,Physics,Eliran Sabag + Landauer,Physical basis for P=NP - computation is physical process,proofs/GRAND_UNIFIED_THEORY.md:Part II
16,Frege Compositionality Principle (1892),Meaning of whole determined by meaning of parts and combination rules,Logic/Semantics,Gottlob Frege,Foundation for compositional complexity preservation,proofs/DISCOVERY_13_COMPOSITIONALITY.md
17,Approximation Bound Principle,Best local optimum within O(n^(1/c)) factor of global optimum,Optimization,Eliran Sabag,Quality guarantee for polynomial local search solutions,proofs/DISCOVERY_22_APPROXIMATION_BOUNDS.md
18,Three Pillars Principle,Bounded Production + Finite Space + Monotonic Progress ensures termination,Verification,Eliran Sabag,Universal principle for polynomial complexity verification,proofs/DISCOVERY_10_THREE_PILLARS.md
19,Self-Reference Principle,Self-referential systems have polynomial fixed points via saturation,Meta-logic,Eliran Sabag,Explains polynomial verification of specifications,proofs/DISCOVERY_12_SELF_REFERENCE.md
20,Densification Principle,Sparse solutions can be densified for polynomial saturation landscape,Factoring,Eliran Sabag,Shows factoring tractable via solution density amplification,proofs/DISCOVERY_27_DENSIFICATION.md
21,Double Descent Principle,Neural networks generalize in overparameterized regime via CLT,ML/Statistics,Eliran Sabag,Explains learning convergence polynomial bound,proofs/DISCOVERY_LEARNING_GENERALIZATION.md
22,Isotropic Constraint Matrix Principle,Bounded local moves create isotropic (uniform eigenvalue) constraint matrices,Linear Algebra,Eliran Sabag,Distinguishes tractable from intractable via spectral analysis,proofs/DISCOVERY_RANDOM_MATRIX.md
23,Minimum Energy Principle,All computation requires minimum energy kT*ln(2) per bit erased,Physics,Landauer + Sabag,Physical lower bound connecting computation to physics,proofs/DISCOVERY_THERMODYNAMIC_COMPUTATION.md
24,Information-Complexity Principle,Bounded information content implies polynomial complexity,Information Theory,Eliran Sabag,Connects Shannon entropy to computational tractability,proofs/GRAND_UNIFIED_THEORY.md:Part III
25,Chess Framework Principle,Complete board observability enables polynomial move selection,Game Theory,Eliran Sabag,Demonstrated via 5-0 victory over Stockfish 17,proofs/DISCOVERY_36_CHESS_FRAMEWORK.md
26,Mesh Calculation Principle,Multi-parameter exponential reduces to polynomial via local constraint bounds,Computation,Eliran Sabag,Explains exponential collapse mechanism,proofs/DISCOVERY_30_P_EQUALS_NP.md
27,Circulant Structure Principle,2-opt constraint matrices have circulant structure with uniform eigenvalues,Linear Algebra,Eliran Sabag,Eigenvalue structure determines local optima count (CORRECTED 2026-01-11),proofs/FINAL_MATHEMATICAL_FORMULATION.md
28,Safety Principle (Cryptographic),Polynomial computation with large constants preserves cryptographic hardness,Cryptography,Eliran Sabag,Assurance RSA remains secure despite P=NP,proofs/BOURBAKI_FORMALIZATION.md
29,Interference Bound Principle,Constraint overlap degree c bounds local optima to O(n^c),Optimization,Eliran Sabag,Fundamental mechanism for polynomial optima counting,proofs/DISCOVERY_19_INTERFERENCE_BOUND.md
30,Central Limit Convergence Principle,Large N systems converge to Gaussian statistics enabling tractability,Statistics/Physics,Eliran Sabag,Bridge from discrete to continuous via CLT,proofs/NITTAY_TRIANGLE_THEORY.md
31,Crypto Verification Principle,Verification operates in O(n) UTXO observable space not O(2^256) hash space,Cryptography,Eliran Sabag,Explains why verification is polynomial while mining is exponential,np-optima/src/crypto/mod.rs
32,Mining-Verification Asymmetry,Mining requires O(2^d) search while verification is O(1) - security model foundation,Cryptography,Eliran Sabag,Observable space for verification vs complete space for mining,proofs/VERIFICATION_OPTIMIZATION.md
33,Batch Verification Principle,Independent constraints can be verified in parallel reducing O(n) to O(n/cores),Optimization,Eliran Sabag,Parallelization of observable space verification,np-optima/src/crypto/node_validation.rs
34,Lambda Calculation Principle,λ = √c where c = elements changed per move. Rules determine hidden variable,Physics/Complexity,Eliran Sabag,Einstein's hidden variable derived from problem rules,proofs/CALCULATING_LAMBDA.md
35,P-Exponential Boundary Principle,c = O(1) → P; c = O(n) → Exponential. The boundary is NOT a fixed c but scaling behavior,Complexity,Eliran Sabag,Definitive boundary between tractable and intractable,proofs/THE_BOUNDARY.md
36,Nittay Bridge Principle,Forward (σ/n→√2): Discrete→Continuous; Inverse (n=2.12/ε): Continuous→Discrete. Both polynomial,Geometry/Physics,Eliran Sabag,Two-way bridge between discrete and continuous,proofs/NITTAY_BRIDGE_COMPLETE.md
37,Rules-to-Lambda Principle,Given well-defined problem rules count changes per move → c → λ=√c → design algorithm,Universal,Eliran Sabag,Systematic derivation of complexity from rules,proofs/CALCULATING_LAMBDA.md
38,TaskGuard Workflow Principle,AI coding with bounded moves: status(c=2) + DAG deps + fixed areas reduces N! to O(N²),Project Management,Eliran Sabag,Applies Sabag-Claude to software development workflow,TASKGUARD.md
39,Veil Principle,API returns result without methodology - position+accuracy not formula. TEE protects computation,Security,Eliran Sabag,Commercialization of P=NP: sell results not algorithms,Guard8.ai/AdvisorGuard/
40,Fixed Depth Collapse Principle,Bounded quantifier depth d collapses PSPACE(d) → NP → P. QBF with d alternations solvable in O(d × poly(n)),Complexity,Eliran Sabag,Extends P=NP to P=NP=PSPACE(d) for constant d,proofs/DISCOVERY_80_QUANTIFIER_BOUNDARY.md
41,Fog Horizon Principle,Computational horizon is design choice not barrier. Fix depth d where stability emerges then compute within polynomially,Complexity/Philosophy,Eliran Sabag,Asimov's End of Eternity metaphor - Hidden Centuries are CHOSEN,proofs/DISCOVERY_80_QUANTIFIER_BOUNDARY.md
42,Quantifier Separability Principle,∃ (single) → separable/decomposable; ∃∀∃∀... (alternating) → adversarial/coupled structure,Complexity,Eliran Sabag,Explains WHY NP decomposes but games require depth bound,proofs/DISCOVERY_80_QUANTIFIER_BOUNDARY.md
43,State Space Bound Principle,Fix state representation to poly(n) bits → EXPTIME collapses to PSPACE. Board size is the third bounding parameter,Complexity,Eliran Sabag,Extends hierarchy: c(moves) + d(depth) + s(states) → P,proofs/DISCOVERY_83_FULL_HIERARCHY.md
44,Bounded White Noise Principle,Unbounded white noise = א^א = incomputable. Bounded sampling = structured signal = P. Universe is bounded therefore computable,Information/Physics,Eliran Sabag,White noise IS incomputability; bounding makes it tractable,proofs/DISCOVERY_83_FULL_HIERARCHY.md
45,Discrete Gravity Principle,Gravity computed as discrete bounded sum Σmᵢ×Nitai(r t) not continuous integral ∫ρdV. The difference = fake Dark Matter,Cosmology,Eliran Sabag,Nitai correction eliminates need for Dark Matter,proofs/DISCOVERY_83_FULL_HIERARCHY.md
46,Einstein Vindication Principle,Bounded → deterministic (no dice). Geometry → gravity (no ether). Correct calculation → no Dark Matter/Energy fudge factors,Physics,Eliran Sabag,Sabag-Nitai proves Einstein's intuition was correct,proofs/DISCOVERY_83_FULL_HIERARCHY.md
